{
  "schema_version": "evidence-batch-proposal.v1",
  "proposal_hash": "3648869670940a1475f743cce003faa1389f8fb376cbc8e4078bc2dc76a00d72",
  "execution_scope": "SIGNED_SYNTHETIC_ONLY",
  "writer_mode": "PROPOSAL_ONLY",
  "formal_sink_eligible": false,
  "command_id": "COMMAND_P5_ONE",
  "logical_run_id": "RUN_P5_ONE",
  "attempt_id": "ATTEMPT_P5_ONE_1",
  "thread_id": "grt.v1.018f6b7ec30a7430982fffc520c8195c",
  "manifest_id": "MANIFEST_P5_SYNTHETIC_ONE",
  "manifest_hash": "cd6153b05b81e9362cced88872f596bea0cf8e456889cb27bb34fce290be04e3",
  "item_count": 1,
  "ordered_item_keys": [
    "EVIDENCE_SYNTH_001"
  ],
  "assessment_refs": [
    {
      "evidence_id": "EVIDENCE_SYNTH_001",
      "assessment_status": "COMPLETED",
      "assessment_hash": "2945f7364bce768063509edf28972cad140bddec3d894170f5818e88853ecb23"
    }
  ],
  "coverage_status": "COMPLETE",
  "proposed_fact_links": [
    {
      "fact_id": "FACT_ORDER_DAMAGE",
      "evidence_ids": [
        "EVIDENCE_SYNTH_001"
      ],
      "source_refs": [
        "SOURCE_SYNTHETIC_001"
      ]
    }
  ],
  "proposed_review_items": [],
  "profile_versions": {
    "graph_version": "evidence.v2.0.0",
    "checkpoint_schema_version": "evidence-checkpoint.v2",
    "state_schema_version": "evidence-graph-state.v2",
    "prompt_version": "evidence-prompt.v2",
    "model_profile_id": "evidence-model.synthetic.v1",
    "assessment_output_schema_version": "evidence-item-assessment.v1",
    "terminal_output_schema_version": "evidence-batch-proposal.v1",
    "policy_version": "evidence-policy.v2",
    "guardrail_version": "evidence-guardrail.v2",
    "tool_policy_version": "evidence-tools.synthetic.v1"
  },
  "completed_at": "2026-07-22T12:05:00Z"
}
